,name,address,min_price,max_price,currency,cuisine,description,star,comfort,delightful,services,phone,website,hours,lat,lon,url,country,country_alpha2,continent_code,USD_min_price,USD_max_price,aggregate_cuisine,coast,region
74,Coi,"373 Broadway, San Francisco, 94133, United States",75.0,150.0,USD,CONTEMPORARY,"Warm, neutral tones and a soft, diffused glow from rice-paper panels welcome diners to this jewel. Over in the kitchen, Chef Erik Anderson is kicking things up with his very own culinary style. He has steered away from seafood, and as a result one is more likely to find a panoply of game birds on the menu now. Changes aside, meals remain a well-executed show. Settle in to this admired retreat for an intimate parade of elegantly prepared and thoughtfully composed dishes. Topped with oxalis and matchsticks of radish, the citrus-infused “marshmallow” accompanied by curd is delicate and impressive. Thin slices of geoduck with tremulous clam-juice jelly is luscious, while Dungeness crab kissed by crab mayo and lemongrass-panna cotta is on point. Then relish a tourte of duck and sweetbreads, enriched by Armagnac prunes and black truffles. It’s hit after haute hit, where even the humble blood orange sorbet dances on the tongue and seals the deal. The experience doesn't end there. Flip to the last page of the leather-bound wine list to discover a unique tea pairing, as well as a sweet-and-savory souvenir to enjoy tomorrow-if indeed you can wait that long.",2.0,3.0,0.0,"['Wheelchair accessible', 'Establishment totally or partly reserved for non-smokers', 'Private dining rooms']",+1 415-393-9000,www.coirestaurant.com,Dinner Tue - Sat,37.79812,-122.40331,https://guide.michelin.com/en/california/san-francisco/restaurant/coi,United States,US,,75.0,150.0,CONTEMPORARY,0,NC
75,Acquerello,"1722 Sacramento St., San Francisco, 94109, United States",75.0,150.0,USD,ITALIAN,"With its air of old-world sophistication, Acquerello is the kind of establishment where one dresses for dinner, which is always an occasion. The room feels embellished yet comfortable, with vaulted wood-beamed ceilings, warm orange walls and contemporary paintings. It seems to draw celebrants of a certain age who are happy to splurge on a white truffle-tasting menu. Chef Suzette Gresham's menus promise expertise and finesse, with a carefully curated wine list to match. Count yourself lucky if your meal begins with their famed parmesan budino surrounded by black truffle “caviar.” Pasta must not be missed, such as the very fine and vibrant tajarin with a tableside shaving of impossibly earthy truffles. Venison medallions wrapped in crisped pancetta are served with beautiful simplicity alongside pear slices, onion jam, chanterelles and butternut squash purée. Refreshing desserts include delicate almond milk-panna cotta covered with vin santo jelly and crowned by buttery crushed almonds, quince and tufts of dehydrated balsamic vinegar. Save room for one of the best mignardises carts you will ever encounter, stocked with superlative house-made chocolates, macarons, pâtes de fruits and caramels.",2.0,3.0,0.0,"['Notable wine list', 'Establishment totally or partly reserved for non-smokers', 'Private dining rooms']",+1 415-567-5432,www.acquerello.com,Dinner Tue - Sat,37.79167,-122.42131,https://guide.michelin.com/en/california/san-francisco/restaurant/acquerello,United States,US,,75.0,150.0,ITALIAN,0,NC
83,Gary Danko,"800 North Point St., San Francisco, 94109, United States",75.0,150.0,USD,CONTEMPORARY,"The elite meet to eat at this throwback favorite, which has been hosting the crème de la crème of the city (and its visitors) since the 90s. Set near Ghirardelli Square in Fisherman’s Wharf, it features two lovely wood-paneled dining rooms and a small, bustling bar, all of them regularly full of hobnobbing business types and couples celebrating big occasions. With bursting flower arrangements, attentive servers and well-dressed diners everywhere you look, it’s hard not to be captivated. The menu focuses on classic cuisine with some global twists; diners can create their own three- four- or five-course prix-fixe, or hand over the reins to the chef’s tasting menu. Luxurious dishes include a luscious rock shrimp and Dungeness crab risotto, accented with butternut squash; branzino with fennel purée, olives and a saffron-orange emulsion; as well as a perfectly cooked herb-crusted lamb loin, draped over date-studded farro and rainbow carrots. While Gary Danko may not be on the cutting-edge of fine dining, its top-notch wine list and outstanding service epitomize old-school luxury. Like the chocolate soufflé with vanilla bean crème anglaise that caps the meal, this is a classic for a reason.",1.0,3.0,0.0,"['Wheelchair accessible', 'Notable wine list', 'Establishment totally or partly reserved for non-smokers', 'Private dining rooms', 'Valet parking']",+1 415-749-2060,www.garydanko.com,Dinner nightly,37.80599,-122.42066,https://guide.michelin.com/en/california/san-francisco/restaurant/gary-danko,United States,US,,75.0,150.0,CONTEMPORARY,0,NC
84,Quince,"470 Pacific Ave., San Francisco, 94133, United States",75.0,150.0,USD,CONTEMPORARY,"An air of refinement touches this dining room—note the massive Murano chandelier, the stylish guests and everything in between. No wonder this is where affluent tourists and locals alike come to celebrate their special occasions. From the moment the champagne cart arrives at your table to the last bite of the guéridon’s mignardises, the service is perfectly timed and attentive. Following suit, the room is as lovely as ever, allowing more space for private parties. There was a time when Quince was home to traditional cooking, but Chef Michael Tusk’s menu is increasingly contemporary. Thin strands of zucchini “noodles” are intertwined with strips of cool and tender squid in a refreshing composition, while a “lasagne” arrives as a square of squab liver layered with greens, accompanied by a piece of medium-rare breast meat and a morel mushroom stuffed with perfect squab mousse. Milk-fed lamb, prepared as a seared chop, braised shoulder and crisped belly, makes for a particularly delightful trio. That mignardise cart is a sight to behold with its dazzling array of diminutive treats, such as the kouign amann, filled with huckleberry jam, as well as macarons, chocolates and nougats.",3.0,4.0,1.0,"['Notable cocktail list', 'Wheelchair accessible', 'Notable wine list', 'Establishment totally or partly reserved for non-smokers', 'Private dining rooms', 'Valet parking']",+1 415-775-8500,www.quincerestaurant.com,Dinner Mon - Sat,37.79762,-122.40337,https://guide.michelin.com/en/california/san-francisco/restaurant/quince,United States,US,,75.0,150.0,CONTEMPORARY,0,NC
85,Campton Place,"340 Stockton St., San Francisco, 94108, United States",75.0,150.0,USD,INDIAN,"The breadth and complexity of Indian cuisine gets its due at this tasteful retreat, tucked into a posh hotel just steps from the luxury boutiques of Union Square. Attired in a soft palette of cream and white, with a striking central glass light fixture, it's a smooth showcase for the freewheeling, colorful food from Chef Srijith Gopinathan. Diners have a choice of vegetarian or omnivorous dishes from the six-course tasting—with an extravagant add-on of white truffle naan for the high rollers in the room. Either way, you’ll be sent on a riotous journey through different textures, flavors and temperatures, along with some truly whimsical plating. Whether it’s a pea-shoot “flowerpot” with quinoa soil or a frozen stone bearing persimmon-kulfi popsicles, the chef's panache is sure to garner wide smiles. That's not to discount this kitchen's exceptional use of flavors as relished in the butter-poached lobster dressed with a coastal curry derived from the chef's grandmother's recipe, or the crisp dosa matched perfectly with a filling of sweet day boat scallops. Cauliflower roasted on charcoal with tomato tokku, kohlrabi and yogurt paired with fluffy kallappam makes for yet another high point.",2.0,3.0,0.0,"['Wheelchair accessible', 'Notable wine list', 'Establishment totally or partly reserved for non-smokers', 'Private dining rooms', 'Valet parking']",+1 415-955-5555,www.camptonplacesf.com,Dinner nightly,37.78923,-122.40665,https://guide.michelin.com/en/california/san-francisco/restaurant/campton-place,United States,US,,75.0,150.0,INDIAN,0,NC
